{"artifacts":[{"expanded_size_bytes":100,"kind":"binary","name":"filterest-linux-amd64","platform":{"architecture":"amd64","cpu_features":[],"libc":{"family":"glibc","min_version":"2.34.0"},"os":"linux"},"sha256":"dddddddddddddddddddddddddddddddddddddddddddddddddddddddddddddddd","size_bytes":100},{"expanded_size_bytes":200,"kind":"source_archive","name":"filterest-source.tar.gz","platform":{"architecture":"any","cpu_features":[],"os":"any"},"sha256":"eeeeeeeeeeeeeeeeeeeeeeeeeeeeeeeeeeeeeeeeeeeeeeeeeeeeeeeeeeeeeeee","size_bytes":100}],"build_identity":{"app_version":"9.3.22","artifact_type":"runtime","build_id":"filterest-9.3.22-stable-runtime-111111111111","channel":"stable","created_at":"2026-10-07T07:00:00Z","database":{"min_version":"9.10.0","target_version":"9.10.0"},"ledger_record_id":"build:filterest-9.3.22-stable-runtime-111111111111","ledger_record_sha256":"aaaaaaaaaaaaaaaaaaaaaaaaaaaaaaaaaaaaaaaaaaaaaaaaaaaaaaaaaaaaaaaa","maturity":"published","product":"filterest","schema_version":1,"source":{"commit":"1111111111111111111111111111111111111111","model":"public_first"}},"capacity":{"allocations":[{"bytes":1048576,"inodes":100,"purpose":"staging"},{"bytes":1048576,"inodes":100,"purpose":"expanded_release"},{"bytes":1048576,"inodes":100,"purpose":"retained_release"},{"bytes":1048576,"inodes":100,"purpose":"database_backup"},{"bytes":1048576,"inodes":100,"purpose":"media_backup"},{"bytes":1048576,"inodes":100,"purpose":"settings_backup"},{"bytes":1048576,"inodes":100,"purpose":"projects_backup"}],"require_inodes":true,"reserve_bytes":1048576,"reserve_percent":10},"composition":{"components":[{"commit":"2222222222222222222222222222222222222222","id":"filterest","version":"9.3.22"},{"commit":"4444444444444444444444444444444444444444","id":"easelect","version":"1.0.1"}],"id":"easelect","revision":8},"created_at":"2026-10-07T07:01:00Z","database":{"migrations":[{"component":"filterest","content_sha256":"bbbbbbbbbbbbbbbbbbbbbbbbbbbbbbbbbbbbbbbbbbbbbbbbbbbbbbbbbbbbbbbb","database_version":"9.10.0","error_policy":"required","id":"20261005000050_require_registry_reference_key.sql","publishes_database_version":false,"transaction_policy":"runner"},{"component":"filterest","content_sha256":"cccccccccccccccccccccccccccccccccccccccccccccccccccccccccccccccc","database_version":"9.10.0","error_policy":"required","id":"20261005000099_record_database_release_9_10_0.sql","publishes_database_version":true,"transaction_policy":"runner"}],"min_version":"9.10.0","supported_starts":[{"app_version":"9.3.21","composition_revision":7,"database_version":"9.9.2","migration_ids":["20261005000050_require_registry_reference_key.sql","20261005000099_record_database_release_9_10_0.sql"]}],"target_version":"9.10.0"},"health":{"exact_app_version":true,"exact_build_identity":true,"exact_composition":true,"exact_database_version":true,"exact_installation":true,"grants_reconciled":true,"health_path":"/health","ready_path":"/system/ready"},"manifest_type":"filterest_release","minimum_trust_policy_revision":1,"platform":{"postgresql":{"extensions":[{"min_version":"3.0.0","name":"postgis"},{"min_version":"0.5.0","name":"vector"}],"max_major":16,"min_major":16},"targets":[{"architecture":"amd64","cpu_features":[],"libc":{"family":"glibc","min_version":"2.34.0"},"os":"linux"}]},"product":"easelect","protocol":{"required_capabilities":["signed_manifest","migration_content_evidence"],"version":1},"published_commit":"4444444444444444444444444444444444444444","publisher":"easelect","recovery":{"backup_scopes":["database","database_roles","media","settings","projects","previous_release"],"mode":"restore_before_reopening","off_host_copy":true,"protected_backup":true,"restore_test_required":true},"release_id":"easelect-r8","release_tag":"easelect-r8","schema_version":1,"version":"9.3.22"}
